{
  "schema_version": 1,
  "task_id": "task-unified-url-only-1",
  "status": "ok",
  "outputs": [
    {
      "index": 1,
      "local_path": null,
      "upstream_url": "https://images.example.test/url-only.png?expires=86400",
      "content_type": "image/png",
      "status": "not_saved"
    }
  ],
  "error": null
}
